### ISSUE TITLE
Wrong Content-Type on S3Client::CreateMultipartUpload 

### ISSUE THREAD

**Issue by rezss** [aws/aws-sdk-java-v2#1092]
Given the following code:
```java
var s3 = S3Client
    .builder()
    .region(region)
    .endpointOverride(URI.create(endpointUrl))
    .overrideConfiguration(c -> c.putAdvancedOption(SdkAdvancedClientOption.SIGNER, AwsS3V4Signer.create()))
    .credentialsProvider(StaticCredentialsProvider.create(credentials))
    .build();

var createMultipartUploadRequest = CreateMultipartUploadRequest
    .builder()
    .bucket(bucketName)
    .key(key)
    .build();
    
var response = s3.createMultipartUpload(createMultipartUploadRequest);
```

## Expected Behavior
As mentioned in the [Documentation](https://docs.aws.amazon.com/AmazonS3/latest/API/mpUploadInitiate.html#mpUploadInitiate-requests), the Content-Type should default to `binary/octet-stream`

## Current Behavior
Instead it is `application/x-www-form-urlencoded; charset=utf-8`:
```
Frame 39471: 867 bytes on wire (6936 bits), 867 bytes captured (6936 bits) on interface 0
Null/Loopback
Internet Protocol Version 4, Src: 127.0.0.1, Dst: 127.0.0.1
Transmission Control Protocol, Src Port: 52049, Dst Port: 9000, Seq: 1, Ack: 1, Len: 811
Hypertext Transfer Protocol
    POST /test-bucket/1550934497162?uploads HTTP/1.1\r\n
    Host: localhost:9000\r\n
    amz-sdk-invocation-id: bdf2ee9c-f733-0b02-0f1c-fc19fb69bc0f\r\n
    amz-sdk-retry: 0/0/500\r\n
     [truncated]Authorization: AWS4-HMAC-SHA256 Credential=SR7SHPUS3UPFD477J4CU/20190223/aws-global/s3/aws4_request, SignedHeaders=amz-sdk-invocation-id;amz-sdk-retry;content-length;content-md5;host;x-amz-content-sha256;x-amz-date, Signature=
    Content-MD5: 1B2M2Y8AsgTpgAmY7PhCfg==\r\n
    User-Agent: aws-sdk-java/2.4.14 Mac_OS_X/10.14.4 OpenJDK_64-Bit_Server_VM/11.0.2+9 Java/11.0.2\r\n
    x-amz-content-sha256: e3b0c44298fc1c149afbf4c8996fb92427ae41e4649b934ca495991b7852b855\r\n
    X-Amz-Date: 20190223T151015Z\r\n
    Content-Type: application/x-www-form-urlencoded; charset=utf-8\r\n
    Content-Length: 0\r\n
    Connection: Keep-Alive\r\n
    \r\n
    [Full request URI: http://localhost:9000/test-bucket/1550934497162?uploads]
    [HTTP request 1/1]
    [Response in frame: 39473]
```

## Workaround
```java
var createMultipartUploadRequest = CreateMultipartUploadRequest
    .builder()
    .bucket(bucketName)
    .key(key)
    .contentType("binary/octet-stream")
    .build();
```

## Your Environment

* AWS Java SDK version used: 2.4.14
* JDK version used: OpenJDK_64-Bit_Server_VM/11.0.2+9 Java/11.0.2
* Operating System and version: Mac_OS_X/10.14.4

**Comment by zoewangg** [comment]
Thank you for reporting! #1108 created to fix it.
